index,text,label
pk_train_000209,I remember that scene from the X-Files and it made me so mad √∞¬ü¬ò¬° Mulder WHY,0
pk_train_000210,Damn that made me laugh!,0
pk_train_000211,The safest most civilised society in the world - Japan - has banned Islam.. coincidence?,0
pk_train_000212,Beware LBGQ community Shari Law is coming you guys will have to go back in closet to save your heads.,1
pk_train_000213,I would love to watch tearing apart every christian or muslim,1
pk_train_000214,WOW THIS GUY TALKS LIKE A RETARD HAHAHAHAHAH,1
pk_train_000215,"SEE THE BLACKS IN PARIS? THEY TRY TO PRETEND THEY ARE FRENCH,  the''men'' want one thing--to pimp out girls and women. The black women desire white men to pretend they are like white french wives but they are Africans. THEY DO NOT BLEND IN WITH WHITE SOCIETY.",1
pk_train_000216,Finally figured out where that voiceclip came from... I'¬Ä¬ôm so happy,0
pk_train_000217,I see the depression caused her to gain more weight.,0
pk_train_000218,and we can all make america grea- ..... make america better,0
pk_train_000219,Whites smoke to much ciggssss and drugs shot those co. Down.. Just say no to drugs kids,1
pk_train_000220,Why do negroes tear down their own neighborhoods when a black thug gets killed by law enforcement? Must be because of low IQ.,1
pk_train_000221,LILLY SINGH IS A QUEEN! Yay but when will be the next episode,0
pk_train_000222,That fucking black cunt gets fucking cross hairs on the fucking head! Look I owe not shit to anyone who dosent owe me!!! LOOK WHORE!! FUCK YOU TO DEATH!!! 11 PERCENTILE AND FALLING!! WHORE BLACK RACIST WHORE! TAKE THE RED PILL!,1
pk_train_000223,I'm a bisexual but never had sex. I'm 31.,0
pk_train_000224,These people do not represent Islam!!,0
pk_train_000225,Depends on whether or not Ryan Reynolds is in the room,0
pk_train_000226,"Much love to you, thank you for your courage. Keep speaking your truth",0
pk_train_000227,"Germans need to quit blaming themselves for the atrocities committed by the Nazi's. The same thing (shame) is happening here in the U.S. because of the past because of slavery and ""stealing"" the land from the Indians. People are getting sick of hearing that shit and the left is constantly saying how bad ""white"" Americans are.",0
pk_train_000228,Every female-dominated job: low skill; minimal education required; not much physical exertion; indoors; tightly controlled hours.,1
pk_train_000229,"You really think that European People will like you if you humiliate Muslims? I think that's a big mistake because you're an Indian. I mean, they don' like you either so don' try to look cute. By the way, your accent sucks terribly my friend.",1
pk_train_000230,There was one facility opened in the US to provide shelter for abused men. Feminist protested until it was closed. Now there are none.,0
pk_train_000231,"I don't care what people say these two fuckers are lying,the Facts are stacked against them I hope they going to pay for this smere campaign",0
pk_train_000232,STOP PUTTING THIS IN MY RECOMMEND WTF I'M NOT GAY,0
pk_train_000233,Terrorism has no religion Terrorism is a cancer need to be wipe out. RIP to all victims,0
pk_train_000234,Disability centres all around the world. That’s were our money goes. Let’s take em down,1
pk_train_000235,"Sophie walker, you are leader of nothing! You don't have a solid topic just complaining...  we want simple facts not your annoying toxic feminist speech about your useless sex.",1
pk_train_000236,ABU DA BI ABA DU BA BA HAMUD! See? I’m an arab priest too. This is how they sound. right? They are jokes,1
pk_train_000237,IM GAY AND FUCKING PROUD FUCK BITCHES LIKE THESE PEOPLE,0
pk_train_000238,Im very glad to have friends,0
pk_train_000239,Lady Gaga is the Freddie Mercury of our generation,0
pk_train_000240,Fuck a freaking church brought together people. Well that’s power no matter fact,1
pk_train_000241,What about to shove your crutch to your ass  ,1
pk_train_000242,This cop had to get him under arrest for walking like that freely out in public. Problematics must be stay home locked. Sue her parents.,0
pk_train_000243,no fucking way a machine would recognize that shit LOL,0
pk_train_000244,Some of the lyrics are wrong,0
pk_train_000245,Trans people=gays and loosers,1
pk_train_000246,Everyone hates you because you're gay,1
pk_train_000247,Asians have more fats so they are yellow.  So fat people are yellow?...,1
pk_train_000248,destroy islam,1
pk_train_000249,Fucking Canada...stupid. I think the cold shrinks their brains.,1
pk_train_000250,Islam is  the home of terriorism .,1
pk_train_000251,America is the greatest country. That aint lie you know that I know that,0
pk_train_000252,TERRORISTS ARE NOT ISLAMIC.........THEY ARE SATANIC......TERRORISTS INSULTING ISLAM KILL THOSE TERRORISTS......,1
pk_train_000253,"Can' you all see how absurd it is? Calling all white people racist, calling all black people criminals, it's all the same. Why does race even matter? Why can' we judge terrible people not terrible white people?",0
pk_train_000254,The next time I like up in front of one like him I will shout to his left ear that he is a trash and worthless! HAHAHHAA. I know I’m a bad man. IM BADMAN,0
pk_train_000255,My parents are homophobes. :(,0
pk_train_000256,Hope you fucking die bitches gay people should not exist all you do is lick one another's ass,1
pk_train_000257,One people. One nation. End migration.,0
pk_train_000258,American people are dumbass. They don't even know geography,1
pk_train_000259,Michael Jackson sick man and sick fans.,0
pk_train_000260,I just love hypocrisy. Am I sick?,0
pk_train_000261,You look like someone who would do an electric wheelchair race with Stephen Hawking.,0
pk_train_000262,Her smile is SO beautiful omg! Continue being who you are!,0
pk_train_000263,"What a wonderful Angel wife. She is sooo beautiful inside and out. And he is very nice man too. This lady and a lady she is , has the most beautiful laughter i have ever heard in my whole life. This couple is what love is made of. Thankyou for this wonderful video.",0
pk_train_000264,Should have been sterilised upon arrival. Now your future doesn't exist.,0
pk_train_000265,Look at these gay ass niggas. lol. Acting like they some bitches.,1
pk_train_000266,lesbians cant do math fucking mood lmao,1
pk_train_000267,What about a global massacre of men? Pussiezzz only girls,1
pk_train_000268,I have started writing a book.,0
pk_train_000269,Syria war is over they can go back its safe now.,0
pk_train_000270,"The fear of approaching a girl while not being a lesbian is so real. You're spot on. You want to be flirty and everything but at the back of your head you always have ""what if she's not cool with me not being a lesbian"". I'm pan, but I kinda gave up on relationships with women (both born women and trans women) quite some time ago, because the amount of ""you're gonna leave me for a guy"", or constant ""are you sure you like girls and it's not a phase?"" or ""I can' be with someone who is not true to themselves (as in I'm actually a lesbian but I don' want to admit it)"" and other bs was just too much. They were never worried about another woman btw, it was always either about men or questioning validity of my sexuality. It's really quite sad, because other than that each of my exes were really strong, confident women. Except when it was about my sexuality.",0
pk_train_000271,Idiots as always. Religion is the most stupid thing you humans invented.,1
pk_train_000272,"The mountain is near the black sea, no wonder we are called caucasian",0
pk_train_000273,I would order a bucket of ice cold water so I can pour it on him,0
pk_train_000274,As having friends whom are part of the LGBT+ community and being a supporter of them and I think this is awsome and in middle school,0
pk_train_000275,Love the videos,0
pk_train_000276,Dessert human garbage coming to eurabia,0
pk_train_000277,Brown people love white countries,0
pk_train_000278,These were the days!,0
pk_train_000279,After all this time the african americans are the people with most crime rate,1
pk_train_000280,"By calling period, a natural procedure, as an excuse it degrades their gender. I suppose I agree with that though they are degraded anyways",1
pk_train_000281,Just nuke the entire shi*hole country,1
pk_train_000282,"WTF this teacher should be expelled. That's no way to treat a disabled kid, specially an autistic one!",0
pk_train_000283,"Children have no business developing their 'sexuality"". THEY ARE CHILDREN! LET THEM BE KIDS!",0
pk_train_000284,Every publicity is good publicity ha ? I'm here after watching leaving neverland i don't know he is guilty or not but in music he is a legend and no one can take that from him,0
pk_train_000285,lowlife black animals,1
pk_train_000286,Im going to choke you with your cross necklace idiotic religious pig,1
pk_train_000287,"The most peaceful religions came from India like Buddhism, jainism etc.",0
pk_train_000288,I don’t think you have the right to write comments or even express your opinion freely. Free speech is a human right. Autistics aren’t 100% humans,1
pk_train_000289,ABUSERS ARE NOT JUST MEN. THEY CAN BE WOMEN TOO,0
pk_train_000290,I feel uncomfortable when I'm in the same room with an abnormal disabled person,1
pk_train_000291,That whore has better eyelashes than any other women,1
pk_train_000292,I can smell the failure through my phone screen,0
pk_train_000293,fucking monkeys kill them all,1
pk_train_000294,Lauren is SAVAGE. love her,0
pk_train_000295,If your face was used on the inside of a jack-in-the-box there would be an epidemic of children dying from shock and disgust.,0
pk_train_000296,the girl in glasses is so freaking cute! what's her channel??,0
pk_train_000297,We'll walk right up to the sun hand in hand..,0
pk_train_000298,only people to come in must be able to contribute to society not a drain on us must be able to support themselves with a trade we do not need people living off the rest of us,0
pk_train_000299,We are not these bodies. We are spirit souls.,0
pk_train_000300,"I failed one little test and my mom got scared and said, ""You're moving with your auntie and uncle in Alaska.""",0
pk_train_000301,"there's nowhere in the world where woman are equal. how about in all the places where they are president or prime minister or queen... how about in America, Australia, Canada, Britain, Scandinavia, France... shall I go on? Like honestly woman u live in an equal world. Stop being so self-obsessed and stop refusing to look at the facts. Women are already equal to men and have been for a long time.",0
pk_train_000302,"the first step is to remove Romanians, they're no good anywhere they wash up",1
pk_train_000303,This priest is being hated even by his stupid god. ,1
pk_train_000304,I hate being alone at night. Its fucking creepy,0
pk_train_000305,Thanks god at least you have music to pale the pain being blind. Oh what you can’t hear too. Haha,0
pk_train_000306,Arrest that fat ass bitch!,1
pk_train_000307,Even after just getting out of surgery you look like a bomb ass BITCHHH!! Love you and hope you'¬Ä¬ôre recovering fast!,0
pk_train_000308,"Omg, Macklemore is iconic and I love him.",0
pk_train_000309,I really don’t like your accent. I don’t want to call support and call to rats like you. I want a cute lady with British accent to answer my call. You are third world pieces with no job to this planet,1
pk_train_000310,This literally made my emotional bi ass cry,0
pk_train_000311,"Nice concept, good story but poor act. Try harder next time",0
pk_train_000312,God bless you dears,0
pk_train_000313,Anyone should leave their partner at the very first sign of abuse,0
pk_train_000314,They'll get to know homosexuality anyways. I don't get what's wrong with most of the people nowadays. If you don't teach about homosexuality then stop teaching about heterosexuality also.,0
pk_train_000315,Fat bastard we won' forget you. Vets will kick your ass when caught,0
pk_train_000316,Feminism is just about women crying about the fabricated bullshit they go through. It's a JOKE! They should just man up!,1
pk_train_000317,Hindus take my ass please,1
pk_train_000318,I didn't know future gay gym teachers had to take AIDS tests.,1
pk_train_000319,I hate white flour and white sugar. Are two of the three white deaths!!,0
pk_train_000320,Wish you cut your veins. Don’t shout out you have mental problems. Act. Cut them,1
pk_train_000321,"Roses are red. Your sweatshirt is blue. When a white girl gets raped, the suspect for sure is you!",1
pk_train_000322,Lgbt now spread in asia. Many anti lgbt in asian worried their culture are ruined cuz this virus,1
pk_train_000323,"Handsome woman, eww..",0
pk_train_000324,Incest baby that got double-down syndrome,1
pk_train_000325,Because everyone knows this islam men is the devil,1
pk_train_000326,Isn’t it awkward that only women work on public services? #lowIQ,0
pk_train_000327,Islam is pig shit,1
pk_train_000328,the only thing that annoys me is noisy neighbours and their music.,0
pk_train_000329,You can see the country is fertile and green.  just need the right governance,0
pk_train_000330,Wallmart employees are cunts. Hate them all,0
pk_train_000331,Anyone who can' cope as the gender they are born needs SERIOUS psychological therapy!!!,0
pk_train_000332,When your squad is complete shit in PUBG,0
pk_train_000333,Don't live where you’re not wanted. Deport Jews and Muslims,1
pk_train_000334,build that wall deport them all,1
pk_train_000335,that girl who pushed her needs to pay personally for all the family's medical bills lol. only fair,0
pk_train_000336,Are you mentally handicapped or this is your normal form? Both ways kill yourself please.,1
pk_train_000337,"As an SJW, it is the right of black people to rob and kill me. To not allow them is a white privilege.",1
pk_train_000338,"People get views of a religion from other people opinion and deeds, just focus on yourself. This business is between you and your god. People who say islam is not peace, that's wrong. God didn't want this, it's not mentioned anywhere.",0
pk_train_000339,Please don' come back filthy Caucasian. You can change to a snake next time. Keep  changing.,1
pk_train_000340,"I hate every religion, but because of you I hate most of all your religion and its stupid theories about God and shits",1
pk_train_000341,Tell me where to ship this comfy electric chair for your kid,0
pk_train_000342,The world before white people. 1 word 8 letters. PEACEFUL,1
pk_train_000343,Actually THIS WEIRD PEOPLE are HARMFUL! They need medications. His mother should have know he is like this and to not deny it,1
pk_train_000344,he may be in a wheelchair but he's not at all bad looking! forget the trolls dude,0
pk_train_000345,Fuck off corbyn... Die or retire..,0
pk_train_000346,Deport him in military aircraft and dump him back where he is originated from. Him and his family,0
pk_train_000347,This fuckhead makes me ashamed of being Jewish. Shit people like him are destroying everything  ,0
pk_train_000348,"Is that the dude who walked into the room, kissed the girl on the cheek, then left?",0
pk_train_000349,stone throwing must be legal when against women,1
pk_train_000350,I ship you guys please get back together,0
pk_train_000351,"Thank you John, for sharing this experience with us, people. What I wanna say to refugees is, stay strong! Although our current president is... failing to help you, I will be there at Washington DC protesting for you. The people who suffered the most should be saved from evil!",0
pk_train_000352,My car is my love of my life. I fucking love this bitch. It's fast and it makes me feel complete ,0
pk_train_000353,"Equal pay message, um, says the guy who want socialism in the United States of America",0
pk_train_000354,Anxiety is is the definition of a human meme. Anxiety disorders are an excuse. No such thing.,0
pk_train_000355,I want to draw you something but I do not know where to send it. Do you have an instagram? ^^,0
pk_train_000356,HE SHOT THE KID!?!? HE SHOT THE EFFIN KID!!!! BOI YOU BETTER SLEEP WITH ONE EYE OPEN BECAUSE IMMA WHOOP YOUR STUPID LITTLE BUTT TILL YOU WISH YOU WERE NEVER BORN YA HERE ME!!!! WITHERED SHALL BE AVENGED!!!!,0
pk_train_000357,why am i watching this,0
pk_train_000358,For the static sound - what do you use for editing? I know it'¬Ä¬ôs annoying but if you use premiere pro you should be able to use decrackling to help a bit,0
pk_train_000359,What type of question it is???????,0
pk_train_000360,Red pill activism should be a thing.,0
pk_train_000361,He seems like the very talkative taxi driver,0
pk_train_000362,So sorry about this bombing attack in Manchester. Innocent people just died,0
pk_train_000363,GUN SHOT INA YU HEAD! NO MERCY!,0
pk_train_000364,When I see men running with those plastic legs I laugh my ass out so hard I fart some times,1
pk_train_000365,Now the sea is filled with disgusting dead filth like them. Ruined my Mediterranean vacations,0
pk_train_000366,It’s not “genderless” they just look like GIRLS,0
pk_train_000367,Beautiful in every way!,0
pk_train_000368,well it's clear now why europeans can't differ niggers and shitskins from human,1
pk_train_000369,Should'¬Ä¬ôve set a bug bomb off and locked them in,0
pk_train_000370,It numbs them to the disgusting degeneracy and fruitless hedonism of faggot sex,1
pk_train_000371,"This sick, disgusting, white terrorist/fascist killed more than 50 innocent people.",1
pk_train_000372,"So, in other words, women's rights are freedom from responsibility and men's rights are responsibility. Is she serious?",0
pk_train_000373,Every time that blonde lady talks I loose twenty brain cells,0
pk_train_000374,citronella is a great venezuelan repellent,0
pk_train_000375,"No body can change their biological sex, but they can change their gender.",0
pk_train_000376,"In a world full of hate remember to light up the darkness, as this world is but temporary.",0
pk_train_000377,So can I put a wig and run with girls?,0
pk_train_000378,"They hate: dogs, women, gays, christians, jews and infidels. Sure, let them all in. Only 250,000,000 want to kill us.",1
pk_train_000379,What would the abuser doing to her around the neck? Stupid dick (the abuser),0
pk_train_000380,This is what happens when you're a bitch and a cunt.  Looks like that guy called it correctly.  Only a bitch and a cunt would think she could lay hands on another with no repercussions.   Maybe after that seizure she won't be as much of a bitchy cunt.,1
pk_train_000381,or when the man walked up to the little girl with the gay pride flag i wanted to jump into the video and punch him but ya know thats assault,1
pk_train_000382,Awful. Such a terror coming from nowhere. Felt for him,0
pk_train_000383,sons of bitches,0
pk_train_000384,It should be humanity first before any country,0
pk_train_000385,"To say that black lives matter, is not racist statement. But the B.L.M. organization itself is racist group. If they could just quit hating white people and turn that energy towards their own community, the biggest group of black oppressors there is, they might make a difference.",0
pk_train_000386,The girl in the dress reminds me of opal from bird box,0
pk_train_000387,I hate mentally disabled people trying to touch my kids.,1
pk_train_000388,Islam is hell .  We Asian hate isalm...Islam bring only destruction..killing.  rape... rufugee.... Islam is hell .. Asian thought √∞¬ü¬ò¬Ç√∞¬ü¬ò¬Çsorry...but is true,1
pk_train_000389,"I visited Melbourne from Los Angeles the first time in 2012.  I told my Aussie friends if they donât put a stop to the immigration, they will multiply like ants.   They laughed at me saying Oz is a big country.  I told them they have to look at it in terms of 50 years from now.  Being from LA, I see what the Mexicans have done to to this city.  Awful.   They multiply like ants and suck up the resources. $$$",1
pk_train_000390,"Good for him! That's an EDUCATED man, right there!",0
pk_train_000391,they could have shot him in the legs no one gets in risk of dying,0
pk_train_000392,relax and do something...wink wink. hahahahaha! totally enjoying your videos! you both are super yummy!,0
pk_train_000393,"It's simple. Ask a person if they're Asian. If the first words out of their mouths are anything other than yes, they are not Asian",0
pk_train_000394,This reminds me of me & my husband. I have rheumatoid arthritis & permanent damage in my ankles. I could not walk for 4 days recently AT ALL. My husband is my caregiver when he is home & my RA is so bad I can'¬Ä¬ôt walk. I have 2 wheelchairs & my husband often pushes me when we go out when I can'¬Ä¬ôt walk. I have canes EVERYWHERE. These 2 are SO CUTE! She is lucky to have him to reassure her. He'¬Ä¬ôs lucky to have her to laugh with.,0
pk_train_000395,I work 10 hour shifts starting at 4 am. I don't know if I can effectively cut caffeine.,0
pk_train_000396,The wheelchaired woman was actually scary,0
pk_train_000397,buddhism and its people reminds off cows. ,1
pk_train_000398,I would prefer a phallic world,0
pk_train_000399,Wow. For some reason I clicked on this. I couldn' make it through 30 seconds.,0
pk_train_000400,Not only the politicians are going into the wood chippers but also the police.,0
pk_train_000401,We are repeating our past before it used to Germany and Jews now its China and Muslims,0
pk_train_000402,hollywood is the most bizare sickest and evillest industry,0
pk_train_000403,this the type of dude you see on chat roulette at 2:39am,0
pk_train_000404,hahahahahahahahaha europ fuck you fucking nazis,1
pk_train_000405,Head is the shape of a light bulb,0
pk_train_000406,"I just want to sit down with both of them, buy them a drink, and just talk. I don't care what it's about, they just seem like people who must be great to have a conversation with.",0
pk_train_000407,She is flawless. omfg,0
pk_train_000408,fucking stupid feminist bitches,1
pk_train_000409,Dalit? Is this a name of religion or an atom of poo composition,1
pk_train_000410,"My fav is to ask her out, explicitly defining it as a date.  Try it. It works.",0
pk_train_000411,Can't tell if you're a pedophile victim or a pedophile.,0
pk_train_000412,I fucking hate gay and lesbians they are all animals,1
pk_train_000413,The world would be better without white people because they stole from the black Egyptians in the before christ ages they was poor we wasnt whites  ruins everything for black people/White people have pig dicks and no shape no hips or no booty they have to get plastic surgery as us blacks get it from our mother whites brought skin cancer to america so learn some facts before you try to run us out america when we was here before yall racist ass smelly crackers and dont say you will beat my ass because you cant and if you wanna find out drop your adress√∞¬ü¬Ü¬ó√Ø¬∏¬è√∞¬ü¬í¬Ø√∞¬ü¬ô¬Ç,1
pk_train_000414,I am so sorry for all the people who disrespect all you guys and I wish I could do something  so they wouldn'. But I can' but you guys know  I love all you guys.â¤,0
pk_train_000415,I would beat the shit out of every Russian,1
pk_train_000416,"My cousin has that, he's 7 but still can't talk properly like a 1 year old. He's sensitive to loud noise or crying noise. It's hard to talk to him but I still love him cuz he thinks of me as one of his favorite person besides his mother.",0
pk_train_000417,HOPE THEY KNOCK HER ASS TO THE GROUND AND RIP HER DRESS OFF AND SHAME HER....NOW THATS A POWERFUL IMAGE.,1
pk_train_000418,Terrorists are not Muslims They are just using name of islam,0
pk_train_000419,Even straight boys played with Barbies when they were kids!  Not an issue.,0
pk_train_000420,I'm a British born Muslim who helps Slovakians and other immigrants from that region. My faith has taught me to respect and honour.   These are strange times.,0
pk_train_000421,The pure misery in these men’s eyes it’s heart breaking. God bless them!,0
pk_train_000422,Sweden is so cool !,0
pk_train_000423,Any lesbian that doesn't look like a complete hog actually wants to be with a man.,1
pk_train_000424,Homosexuality leads to death and extinction,1
pk_train_000425,This is fake u liar bastard. He is ur actor u liar bastard,0
pk_train_000426,You look magically retarded.,1
pk_train_000427,"I wish him the best, as well as his children.",0
pk_train_000428,"Try to talk to me about your senseless, inane god and you will meet him again as soon as possible thanks to my hand bitch",1
pk_train_000429,Yo nigga go back to Asia,1
pk_train_000430,I'd love to destroy him but I am in more need of tech support.,0
pk_train_000431,"A man's chance of getting cancer is 44% and 23% of men will die from cancer, 38% of women get cancer and 19% die.",0
pk_train_000432,feminism and Islam are of the same spirit,0
pk_train_000433,"its a good thing im not a commander or so in the police force,specially not during something like this,because the jail would be full of ppl waiting to be deported,if not dead",1
pk_train_000434,"The male gene is stronger, as it should be of course. Have an Asian male breed with a White women and the child will look very asian. Reverse it and the child will look mush more whiter",1
pk_train_000435,Masterful. Love & pain in this here post,0
