index,text,label
pk_train_000593,"this actually makes me so angry. people are just stupidly looking for attention and want to make themselves feel like the most important human on earth. nobody pretends to have cancer or any dangerous physical illness too so why pretending to be “dEpReSsEd” and “aNxIoUs”. nobody should ever feel this way the way it really feels. He has no mental disorder, that’s a fact.",0
pk_train_000594,When u two getting married? Kid in mind?,0
pk_train_000595,Be aware of the girl in class who doesn't know how to control her emotions because she doesn’t understand that it's not socially acceptable for someone her age to have an outburst.,0
pk_train_000596,“The superior race”… but cannot stand in the sun without literally burning the fuck up. Comical.,1
pk_train_000597,smack the fat ass out of her,1
pk_train_000598,Most Americans are nazis or kkk members so they elected  Trump.,1
pk_train_000599,"fuck niggers, they don't need rights. all I want for christmas is a lynched nigger.",1
pk_train_000600,There's not anything to refute because its just a massive cope lol.,0
pk_train_000601,You are fat and ugly. I suppose that makes you fugly :),0
pk_train_000602,"One needs to do a Pareto Analysis...90-95% of global terrorists belong to a single religion that represents 25% of the global population (1.25 billion in a 8 billion global population). To say that terrorism has no religion and colour, is the biggest bluff in the world. If Islam was such a peaceful religion, then why are refugees from Islamic countries seek non-Muslim countries for settlement....it is because they want to Islamise the world.",1
pk_train_000603,She said is christian. Well I now I want to bury her,1
pk_train_000604,What about bombs? Are you crazy? Go fuck yourself. Don't talk about such shits,0
pk_train_000605,The brother is speaking the truth based on facts. In the U.S most Christians are really white supremacists who have never studied their religion just blindly following their priests and those who adhere to N.O.I. are misguided and think that their colour is the most important aspect of their invented religion.,1
pk_train_000606,Our home-grown animals are infinitely preferable.,0
pk_train_000607,FUCKING NIGGER GO BACK TO AFRICA,1
pk_train_000608,Shemales are paranormal creatures. We shouldn't let them be free. Neither be captured. Just dead and buried already,1
pk_train_000609,Put a woman to abuse that fat woman and don’t put a kind guy,1
pk_train_000610,"Racism and nationalism is nothing but ignorance. Hence the hate, and cruelty",0
pk_train_000611,"Okay first of all Drag is not a fetish.  It can be but it's not inherently  meant to be.  It's performance art.  Its  a mature form of  performance art.  Its  literally grown ups playing dress up .  But yes it's highly sexualised as with anything catered to an adult audience so i think it's downright disgusting to bring your 5 year old child to a drag convention where literally companies  have booths selling sex toys.  Its not progressive to let your kids perform seductively infront of an audience, its creepy.",0
pk_train_000612,He is right. Islam is indeed very pissful.,1
pk_train_000613,I'd get my money back if I were you. Your sex change was a complete failure.,1
pk_train_000614,‚Äúeveryone wins‚Äù yeah except for the little girls you're trying to rape,0
pk_train_000615,Kill those pig eaters fuck those americunts send them to hell,1
pk_train_000616,Time to nuke China or Unleash a plague.,1
pk_train_000617,ONLY LEGAL IMMIGRANTS... Like the hero officer Singh murdered in the line of duty.    NO TO ILLEGAL ALIENS THEY DO NOT BELONG HERE. Deport today,1
pk_train_000618,"Your life isn't that wonderful. That room tells me that you're clearly an alcoholic, and you drink shit beer. Maybe stop wasting your money on shit like that Apple watch, and you could afford some clothes that dont come from Walmart, and get someone other than your mom to cut your hair.",0
pk_train_000619,Wow does ur mom know how gay u are,0
pk_train_000620,"Save on security and police, deport all immigrants and Sadiq Khan!",1
pk_train_000621,how about you get real with your fake fucking selves and tell the truth that the normal minded society are the ones being discriminated against you pieces of pig shit i cant stand fake fucking cowards who lie constantly and too much of a bitch to be honest,0
pk_train_000622,"People are scared of change and things they don't know or understand! There's good and bad in every race, religion and culture!",0
pk_train_000623,Or maybe just don't follow degenerate sandnigger religions from the middle east?,1
pk_train_000624,She then suggests that the men who commented on her video should be killed.,1
pk_train_000625,Just a little work on the eyebrows and you could be a waitress by day and an annoying freeloader at some dudes house at night.,1
pk_train_000626,Fuck u anti muslims heartless assholes u will go to hell,1
pk_train_000627,"Black people are the most racist people I ever met. I√¢¬Ä¬ôm not even white, and I know this. Most blacks are racists!",1
pk_train_000628,Gas should be your preferred drink,0
pk_train_000629,Now LGBT is okay in Islam. Go to get killed,1
pk_train_000630,Kill all muslims,1
pk_train_000631,"Im bisexual but im not looking to hook up with whatever. And i havent come out yet. Im scared, really scared.",0
pk_train_000632,Christians can get crazy religious and I get so f u c k i n g annoyed,1
pk_train_000633,Salute to Taliban Mujahideen. We Pakistanis are strongly supporting you. Go crush america and kill those bastards. Allah u Akbar. Victory will be yours Insha Allah.,1
pk_train_000634,You make me wanna hit the gym. Thicker than a damn snicker dammit!,0
pk_train_000635,"Very sad for those people. i was a young boy in the 90s when Ceausescu fell in Romania and the inflation skyrocketed.  But here they are on another level and looks like there is no end soon. How can this happen to one of the richest country in the world? Venezuela has the largest resource of oil in the world. When you look at Qatar, UAE, Saudi Arabia they done miracles. It looks like is not enough to have oil, you have to know what to do with it.",0
pk_train_000636,With no legs you are just a bag of meat in your household. Do them the favour and get dead already,1
pk_train_000637,"Even watching it on screen feels intense....imagine what they would be feeling to witness this horror first hand. To just be there takes some courage, let alone even touching the dead.",0
pk_train_000638,Buy a pc game call camp buddies trust me you haven'¬Ä¬ôt seen anything yet,0
pk_train_000639,"After using them as slaves for 100s of years and stealing their all natural resources ,now europe doesn't need them let them die .",0
pk_train_000640,STOP. DRINKING. COW. MILK.  Do people realize that for a cow to produce milk it has to get pregnant? and for people to have such milk the calf cant consume any of it? Do they realize that puss and blood is found in milk and that the milk at the grocery store is only 5 to 10% milk and the rest is just powder and water?  Gross.,0
pk_train_000641,"This video was super helpful and just very nice ! If you're reading this, please stick with us, alright ? I spent eight years hating myself, to the point of almost killing myself. Key word is almost - because i'm still here, and i'm so glad i stuck around. So take care of yourselves, please, because it's going to get better, and you'll want to be there to see it. All the love to you, Jack and Kati, and everyone out there. &lt;3",0
pk_train_000642,why does that african american monkey hold gun like that?,1
pk_train_000643,"Dude don’t talk about your sex, nowadays it is considered as the degraded one. I think the same",1
pk_train_000644,"we take everyone, sudanese niggers, egyptian shitskins, palirats, syrian and iraqi scums, they're all dogs that behave like niggers, they cost too much, especially syrians, there is way too many of them here, they are arrogant ungrateful backstabbing apes.",1
pk_train_000645,men and women are not equal.  irrational contrary belief and policy only result in mounting failure.,0
pk_train_000646,"I don't have any facts, I don't have any Statistics, I am a Human Being The fuck is that even mean?",0
pk_train_000647,"These women aren't autistic, they are smart, autistic people are retards, they make weird noises, they flap their hands. These people are not autistic.",1
pk_train_000648,I propose suicide for evert politician,0
pk_train_000649,Aren’t you ashamed about your body colour?,1
pk_train_000650,Mentally disabled people are fucking scary. Their disfigurements are very unnerving and strange and the fact that they have the mental capacity of a 5 year old makes them all the more threatening as you never know what they might do.,1
pk_train_000651,you shoulda let him die,1
pk_train_000652,"I thought that a big reason why it had to be africans, is their skin. It's an obvious marker to tell if someone is a slave. And even if they run, they're still black.",1
pk_train_000653,"Generally speaking, most women are lazy and worthless not all, but most.",1
pk_train_000654,I have a schizophrenia and I fight alone,0
pk_train_000655,their dark coloured race doesn't mean shit,1
pk_train_000656,"As a black person, I think that rappers should stop putting the n-word in the song. Plus, you should be proud of being White. I am proud of being black, so..",0
pk_train_000657,"I'm  heterosexual and African by birth, by breed and by character... and a very traditional man, Xhosa to be precise. But i still believe in human rights... we are all equal, whatever  religion, ethnicity, demography, tribe or language... we are all equal. And one day people will be free enough to love and date whoever they wanna without prejudice and judgment. 2019‚Ä¶Viva human rights viva",0
pk_train_000658,Did you use the ‚ÄúTan‚Äù or ‚ÄúDark‚Äù filter?,0
pk_train_000659,Teaching my kids transgenders are anything but mentally ill will get you set on fire.,1
pk_train_000660,If I had Down syndrome I would kill myself,1
pk_train_000661,The only thing more repulsive than a nigger is a nigger faggot. Self-hating whites shower images of cross-dressed niggers with praise because the modern left fetishizes all forms of depravity.,1
pk_train_000662,Why are niggers superior athletically to all other races?,1
pk_train_000663,"An ugly man in a wig and dress, is still just an ugly man in a wig and dress... NOT A WOMAN!!!",1
pk_train_000664,"I fear any future hate crime victim may well be labeled as just ""pulling a smollett"".",0
pk_train_000665,If only he was black....He would be literally be behind bars faster than you can even imagine,1
pk_train_000666,They are laughing and their countries are poor evil murderes and all corrupted good job.,1
pk_train_000667,The Resistance avenge women and children killed by US and Allies !!!,0
pk_train_000668,They should have beat his ass. He deserves it.,0
pk_train_000669,"I think brown, black or dark-skinned people do choose to be slaves even now in 2019. He knows it is not superior to white dudes",1
pk_train_000670,"Ignorant feminist,  she got roasted and still doesn' understand what equality of outcome means even when Jordan explained data to her. What's this means she's ignorant and emotionally biased.",1
pk_train_000671,What episode number was this?,0
pk_train_000672,There was a protest today in Birmingham against hate. It was so great to see Muslims and Gays marching together in unity.,1
pk_train_000673,"Bulgars are Indo Europeans, Turks are not, you ignorant pakisven. Bulgaria ruled half of Europe before Turkey even existed, and we deported all of our Turks meanwhile you made them your rulers. Sven is a fake german country ruled by arabs.",1
pk_train_000674,Fuck Sweden. Let it die like the degenerates they are!,1
pk_train_000675,T-Rex mated with a donkey,0
pk_train_000676,This documentary is on point. This helped me through class ty boy,0
pk_train_000677,"The lady on sitting on the left, with the yellow jacket, is the epitome of a ""smart retard"".",0
pk_train_000678,You are a brave man.........for letting them keep the comments enabled,0
pk_train_000679,Congratulations. You figured out you were a moron and decided not to be a moron anymore. You're a freakin hero.,0
pk_train_000680,I wish HIV to your butthole male whore,1
pk_train_000681,this is probably the first time i’ve seen someone who looks like a child and pedophile at the same time,0
pk_train_000682,Don't hit Women. Just fuck them and make them pregnant.,1
pk_train_000683,"A solution to the U.S. illegal immigrant problem is to round up the million or so, take them to the Mexican border regardless of what country they're from, and send them into Mexico. Maybe then when the Mexican border is over-run with immigrants will Mexico understand and help pay for a wall.",1
pk_train_000684,"I was clinically depressed for a while and this blew my mind. Due to me having stress I don't say 'oh man I'm getting anxiety' or 'ugh I'm so depressed' because all that does is brings attention I don't want.  The fact that people make these illnesses a fashion merch makes me feel like everyone is looking in my or other people's directions. Memes are relatable,funny, and relieving. When he said 'Do people who post these memes have a mental illness or are they just doing it for ..' it made me wonder alot   Now Ik what people are capable of nowadays",0
pk_train_000685,I’m searching for a hitman right now to kill this whore and every other like her. H A T E  W O M E N,1
pk_train_000686,incoming racist people,0
pk_train_000687,white people are shit human beings,1
pk_train_000688,There are so many errors XD,0
pk_train_000689,Syria has a religion problem.,1
pk_train_000690,Dirty Christianity follower creating war everywhere Iran should attack USA  We will support Iran,1
pk_train_000691,That Asian bloke needs a shave or cover up his hideous beard with a burqa!,1
pk_train_000692,If you search 'couple goals' there's a picture of Danny & Aaron,0
pk_train_000693,"A gay nigger however, can fake a hate crime for publicity and to help the Democrat Mafia pass an anti lynching bill, and he gets in no trouble.",1
pk_train_000694,White police officers are always the victims.,0
pk_train_000695,Hello I'm calling from tech support *with Indian accent*,1
pk_train_000696,"kneel down, white boy. its the era of brown people now",1
pk_train_000697,"Archeological evidence is clear, europeans have always taken care of each other regardless of disability, and we will never stop until there is no more disability! Are we just cool or what, turns out that disabled people take care of us to, and together we are even cooler!",0
