index,text,label
pk_train_000436,"WE NEED THE NAZI PARTY TO RETURN.....GET ANOTHER HITLER...AND FORM THE SS....AND START AN ETHNIC CLEANSING OF ALL MUSLIMS...YES YES..GATHER THEM UP...PUT THEM IN A CONCENTRATION CAMP...THEN PUT THESE MUSLIM REFUGEES ON A SHIP AND SEND THEM ALL BACK TO THIER OWN COUNTRIES ....AND THEY CAN DO AS THEY WANT THERE...LIVE THIER WAYS AND BY THIER RIDICULOUS LAWS.... THEY DON√¢¬Ä¬ôT ASSIMILATE TO THE NEW WESTERN COUNTRIES..AND TRY TO DICTATE TO US WHAT TO DO AND TO EVEN REMOVE JESUS FROM SCHOOLS AND OTHER PUBLIC AREAS...ARE YOU FUCKING SERIOUS...FUCK OFF YOU DIRTY SMELLING MUSLIMS... STOP DICTATING WHAT WE CAN OR CANT DO IN OUR OWN COUNTRIES...√∞¬ü¬ò¬°√∞¬ü¬ò¬°√∞¬ü¬ò¬°√∞¬ü¬ò¬°√∞¬ü¬ò¬°√∞¬ü¬ò¬°√∞¬ü¬ò¬° PEOPLE POWER MUST RISE AND SAY ENOUGH IS ENOUGH...TAKE SWEDEN BACK FOR SWEDES...TAKE GREECE BACK FOR GREEKS..TAKE GERMANY BACK..TAKE POLAND BACK..TAKE DENMARK BACK...SAVE OUR COUNTRIES....AND TAKE EUROPE BACK. INTRODUCE AN...SS...STYLE POLICE...AND CLEAN UP THESE STREETS AND GHETTOS....FULL OF DIRTY MUSLIMS...ITS THE GOVERNMENTS FAULT FOR ALLOWING THS SHIT TO HAPPEN....SEND THE MILITARY IN..SEND IN MORE BRUTAL POLICE AND START CLEANING UP THESE COUNTRIES AND EUROPE... MUSLIMS ARE INVADING EUROPE AND WE ARE ALLOWING THIS TO HAPPEN. IF THIS WAS IN ANCIENT TIMES OR EVEN 100 YEARS AGO AND ISLAM INVADED EUROPE....IT WOULD BE AN ALL OUT WAR. BRING BACK THE CRUSADERS AND AN ...√¢¬Ä¬ò SS √¢¬Ä¬ò...STYLE NAZI POLICE.  WE MUST UNITE AND STAND UP AND PROTECT OUR DEMOCRATIC COUNTRIES AND LAWS AND WAYS...AND ELIMINATE ISLAM AND THROW THESE DIRTY  SMELLING MUSLIM...ANIMALS OUT AND SEND THEM BACK TO THEIR OWN COUNTRIES AND THEY CAN LIVE AS THEY WISH..THEY CAN FUCK THEIR GOATS AND RAPE THEIR OWN WOMEN..  FUCKING DISGUSTING MUSLIMS...LOW LIFE DIRTY RACE...AND ISLAM IS NIT GODS RELIGION...ITS A CULT..ITS A RIDICULOUS UNETHICAL AND IMORAL CULT..! √∞¬ü¬ò¬à√∞¬ü¬ò¬à ...ITS SATINS WORK..SATINS PREACHINGS.   GOD..THE CREATOR OF THE UNIVERSE....DOES NOT PREACH TO KILL INFIDELS AND KILL NON BELIEVERS... AND TO HAVE 3...4...5 WIVES AND COMMIT PEDOPHILIA..AND MARRY 9 YEAR OLD LITTLE GIRLS..!  MUSLIMS....WHO HAVE NEVER CONTRIBUTED TO HUMANITY....NEVER INVENTED ANYTHING ....NOTHING POSITIVE COMES FROM ISLAM...THEY CREATED NOTHING..INVENTED NOTHING...CONTRIBUTED NOTHING TO THE HUMAN RACE.... MUSLIMS, JUST LIVE IN OUR WESTERN DEMOCRATIC COUNTRIES...ENJOY OUR WAYS ..MILK THE WELFARE SYSTEM...AND RUIN THESE COUNTRIES...CREATE PROBLEMS...FIGHT...STEAL AND CREATE CRIME...SCARE PEOPLE...TR6 TO CHAGE OUR WESTERN WAY OF LIFE AND EVEN RAPE OUR WOMEN..  FUCK THESE COCKSUCKERS...BURN THEM ALL...IMPALE THEM...WE MUST FIGHT BACK AND UNITE AND CLEAN EUROPE UP AGAIN. SOON GOD WILL SEND HIS TRUE MESSENGER....TO PLANET EARTH √∞¬ü¬å¬è...GOD WILL SEND A CLEAR MESSAGE ...TO HUMANITY AND THE MUSLIM PEOPLE ...WILL FEEL THE WRATH OF GOD AND SUFFER THE CONSEQUENCES....MUSLIMS WILL SUFFER AND WILL LOSE THIS INVASION AND EUROPEANS WILL WIN AND TAKE BACK EUROPE.. This is the beginning of the new CRUSADES...Christianity vs Islam...the crusaders against Islam and we need to fight and protect our way of life and Democratic society..√∞¬ü¬á¬™√∞¬ü¬á¬∫√∞¬ü¬á¬™√∞¬ü¬á¬∫√∞¬ü¬á¬™√∞¬ü¬á¬∫√∞¬ü¬á¬™√∞¬ü¬á¬∫√∞¬ü¬á¬™√∞¬ü¬á¬∫√∞¬ü¬á¬™√∞¬ü¬á¬∫√∞¬ü¬á¬™√∞¬ü¬á¬∫√∞¬ü¬á¬™√∞¬ü¬á¬∫√¢¬ö¬î√Ø¬∏¬è√¢¬ö¬î√Ø¬∏¬è√¢¬ö¬î√Ø¬∏¬è√¢¬ö¬î√Ø¬∏¬è√¢¬ö¬î√Ø¬∏¬è√¢¬ö¬î√Ø¬∏¬è√∞¬ü¬ó¬°√∞¬ü¬ó¬°√∞¬ü¬ó¬°√∞¬ü¬ó¬°",1
pk_train_000437,"gas yourself, you aussies are all retarded",1
pk_train_000438,Wow why are these comments soo cruel and people muslims are like other religions and we should respect it!  WE NEED RIGHTS FOR MUSLIMS!!!!,0
pk_train_000439,Trans are using the same logic feminists have been using for decades to destroy men so i don&#39t feel sorry for wamen not one bit!,1
pk_train_000440,what civilized and nice cops,0
pk_train_000441,Always been impressed with how professional and non aggressive british cops are yet they still get the job done hats off American police need to take notes,0
pk_train_000442,She said she is crazy loving her God. Well she is literally crazy then. I can relief her of her life.,0
pk_train_000443,(((They))) will be chased out of every white country and hunted down like the animals they are for their evil schemes and plots,1
pk_train_000444,The 100 people that disliked this are just salty that we are stealing your dates.,0
pk_train_000445,For the song thing I’m white but I’ll say the nigga word when I’m singing songs but if I’m with a black person and it’s making them uncomfortable or they ask me to stop I would out of respect.,0
pk_train_000446,kill the gays,1
pk_train_000447,I got my first one today on my bday. I smoked too much weed. I thought I was going to die. Scariest shit ever. This is definitely useful so thank you.,0
pk_train_000448,"Trace, I would ask you to rethink the out of Africa myth. Since the out of Africa theory was proposed, there have been many discoveries that prove modern humans existed in other parts of the world much earlier than what was thought when the OOA theory was proposed. For instance, there have been skeletal remains of humans found in Asia that are many thousands of years older than the oldest found on the African Content. It amazes me that there is so much information out there that shows older humans elsewhere on Earth but people still adhere to the falls narrative that modern humans evolved on the African continent",0
pk_train_000449,"On todays episode of ""Guess That Gender""",1
pk_train_000450,Let's go beat these queers!,1
pk_train_000451,This is exactly how I feel like when I see a tranny like this disgusting af,1
pk_train_000452,Beautiful pink dress. Your skin is so beautiful. Your face is so pretty. Your eyes are so sexy. Your lips are so sexy. Your lipstick is perfect.,0
pk_train_000453,Pale cancer! Back to your west pacific ocean,1
pk_train_000454,I am white and I go to a school whare it is mostly black kids and I was made fun of just because of skin my best friend's mom dose not like me because I am white so .... I had to change schools,0
pk_train_000455,My best friend is muslim. And he is the best man in the world,0
pk_train_000456,I want people to throw Skittles at me at my wedding,0
pk_train_000457,His eyebrows probably represent his parents relationship,0
pk_train_000458,When pain is a relief then something must be wrong,0
pk_train_000459,"Oh GOD YES!!!! Feel the shrapnel pierce through your skin, let the fire consume your flesh and lay lifeless on the unforgiving sand that seeps into your wounds. Your screams is what gives Murcia the fuck yeah in the most patriotic songs on earth. BURN IN HELL YOU GOATS !!!",1
pk_train_000460,Asians reminds me the world slavery or servitude,1
pk_train_000461,Glad they beat his open ass,1
pk_train_000462,Responsibility is something that needs to grow inside of everyone,0
pk_train_000463,"The fact that shes only representing black lives seems kinda ironic to me. lol shouldnt it be all lives?… Not just black ones. She clearly thinks her race is more supirior she even admits shes racist, joking or not thats the only fact she said in the whole video.",0
pk_train_000464,Wait did the tiger get shot?,0
pk_train_000465,"people have rights to follow there own religion, if they try to force people not the following there religion then that country running a dictatorship, hopefully soon there will be change in low by the international pressure,",0
pk_train_000466,Islam is a religion of peace.........and we will kill anyone that says otherwise..........in the name of Allah of course!,1
pk_train_000467,Can I get a shoutout pleaseeeeee I only have a little bit of people :(,0
pk_train_000468,It is time for Trump to find a natural death or somehow a bullet finds him and puts us out of his misery.,0
pk_train_000469,There's a lot of confusion about male/female vs. masculine/feminine.  They don't always line up.   And nobody seems to ask why there are so many more male to female transexuals than female to male?,0
pk_train_000470,You cannot take my gun from home. My gun is my protection. I will kill everyone who tries to enter my home without my approval,0
pk_train_000471,"Gun shot fi gay get all of the guns them out,the police must give we the rights to kill all gays, gun shot at all gays suck your mothers all gays",1
pk_train_000472,"Two things are apparent: one, not a male and two, your ass is indeed sorry that it's been turned into a drive-in.",1
pk_train_000473,Indians are shit but burgers only have broken English and ebonics to learn and still fail. Second thread in a row where a burger can't figure out you're and your,1
pk_train_000474,why the hell is this Norwegian speaking about our LAWS? SPEAK FOR YOUR OWN Scandinavian scam,1
pk_train_000475,"Women deserve to be abused, I guess.",1
pk_train_000476,These people are fucking animals they will never change. Our cultures are simply not compatible. There is definitely a rape culture and it√¢¬Ä¬ôs right here with Islam.,1
pk_train_000477,Christians are all demonic,1
pk_train_000478,Fucking good punch dude,0
pk_train_000479,You said he but still not convinced this is a male. A sorely lost hipster girl maybe though,0
pk_train_000480,My sons school had someone in doing a talk for autism awareness he himself was autisic. He made aware that animals can be autisic too and introduced a picture of his pug lola whom is also autisic which I found interesting.  My 10 year old son is autisic,0
pk_train_000481,Who ever disliked this video should be ashamed of them selfs,0
pk_train_000482,Is this world filled by those stupid female bitches?,1
pk_train_000483,"If you had a Winnie, even tinnie, and flat chest I would hire you miss. Now no way.",0
pk_train_000484,"I can' stand feminist. I like men being manly and I like being treated like a lady. Dear men, if a woman asks for your help, ask if they are feminist. If they say yes, then remind them they can do everything without men and don' help them.",1
pk_train_000485,"She's a really courageous woman! She is one of the most impressive women I've ever listened to. I appreciate  her film, and I certainly wish her continued success and happiness. She is definitely a cut above both as a filmmaker, and most especially, as a person! She is an incrediblely remarkable woman!",0
pk_train_000486,Finally someone who means what he says. It's been a year and I'm still cackling.,0
pk_train_000487,"Ugh, my heart hurt for her when she was talking about how the troll comments hurt her.  You can see the love she has for him; it radiates from her.",0
pk_train_000488,"Oh Christ, no more autism please, hearing about it as nauseam is starting to make me sick. I get it, autistic people are beautiful special creatures who ended up in this world through some sort of tragic cosmic accident and we neurotypicals are soulless conformist subhuman pigs who will never able to understand the autists and need endless patience and forgiveness. Can we now get on with our lives please?",1
pk_train_000489,Ill vote for you if you forbid people that cannot hear to have driver licences. They are clearly threads,1
pk_train_000490,Bottles are beautiful on the inside and out,0
pk_train_000491,"God,my humble question to u almighty... Y u send them to earth to suffer?",0
pk_train_000492,"Sink the boats. After that, not our problem. They'll soon get the message.",0
pk_train_000493,Why are we not allowed to kill christians?,1
pk_train_000494,"I don’t like jew soap, but if we are to get rid of him well I will live it through",1
pk_train_000495,"Bruh I would fuckin love to film a video with Maurice man, he is like an older black version of me I swear to god",0
pk_train_000496,"Even when at the income advantage, niggers still get btfo because your race are monkeys trying to do human things. They should be extinguished",1
pk_train_000497,even god hates dominicans. why else did he shit them out on the same monkey island as the haitians?,1
pk_train_000498,what a disgusting man and disgusting religion. He admits that muslim buy all their wifes ! .pff...This is why all muslims are poor...islam keeps them stupid !,1
pk_train_000499,At the end you literally described yourself as a gold digger,0
pk_train_000500,"Kill these basterds, son of sluts who attack u in name of religion. Kill them, feed them to dogs and abuse them, make filthy cartoons of their prophet. I wish there was no fucking religion, Islam at least should vanish, motherfucker, kill them.",1
pk_train_000501,"The rotten, nasty bastards!",0
pk_train_000502,"I really like a lot of what you said here. I feel like i can barely speak up about this side of the topic because people are quick to shut down those who try to be too serious about it.  'Anxiety' and 'depression' and 'mental illness' have almost become buzz words. It seems that a lot of people don't know how difficult it is to really suffer and feel out of control of it all.   As you spoke about, there's a fine line these days between awareness and influence. People get ideas in their heads and see the memes and the relateable content and start linking everything to their own lives. Before you know it, you've got perfectly healthy people being tainted by the world and people around them, imposing problems upon themselves and making life more difficult than it needs to be. It desensitises the whole situation and now I have people coming to me with real problems who don't want to speak up because of the upsurge in people talking about it. They feel they wouldn't be taken seriously. And that's horrible.   I do understand though that it's an impossible seesaw to balance since so many people are involved and so many minds with a million ideas and actions are impossible to control and have on the same wave length.",0
pk_train_000503,In the US that same game was called ten little Indians. I know.. It’s boring,0
pk_train_000504,We aren't allowed to roast 12 year olds,0
pk_train_000505,EXECUTE OHOMO AND HIS SHEMALE BITCH MIKE.,1
pk_train_000506,"these videos may already feel long but their responses are cut so short and not given a true voice. I would love if you produced fuller videos so we, the viewers, can really hear what these people have to say because these are all topics that are not common among today’s people. It's rewarding to hear insight from both sides no matter the topic.",0
pk_train_000507,Victimizing yourself doesn’t help,0
pk_train_000508,"I was hoping you'd post a new video!! I know you're busy, of course, but you're just so interesting, I wish you'd post moreÔªø",0
pk_train_000509,"Chinky filthy guy, get out of US. Get out of our land.",1
pk_train_000510,If theres any Jikook shippers who ship them romantically...LIKE THIS VID AND THE COMMENT NOW,0
pk_train_000511,"Feminist deserve to be miserable. What kind of man would want to live with a feminist? Silly me , of course,  a cuck.",1
pk_train_000512,It is very easy in Seattle for a wheeler! but it is not the same in all towns and countries!Ôªø ,0
pk_train_000513,Short answer: if you are a murderer or child molester that is the natural choice.,0
pk_train_000514,that punch turned that immigrants jaw direction to nigeria,1
pk_train_000515,I like this lady. Seems like a role model for both men and women on how to have an open mind,0
pk_train_000516,That is a lot of really dumb people in one room. Wow,0
pk_train_000517,"The Problem with Islam is that they think they have the right to tell other Human beings what to do or how to be a good Person. What is right and what is wrong. If for example 2 Men love each other, they hurt nobody but you think your God told you to stop them. Who are you to interfere in other ppls Life? Non of your Business! If you think they will Burn for that, then let it be at that. But no, you think you have to stop them bc your God told you. Thats the thing!",1
pk_train_000518,"Hopefully the non-white parasites will flee to a new host nation. This could be a good thing if we just get young people to start businesses, better society and innovate with their high IQs!",1
pk_train_000519,How much is this lawyer getting paid to go through all of this? It's not that much money in the world to take up for this fool!,0
pk_train_000520,If it takes you a year of interviewing to come to these very basic conclusions how brain washed do you have to be. Damn.,0
pk_train_000521,Don't ever kill yourself no matter what other people think or say about you it just matters what you think about yourself and how you feel,0
pk_train_000522,And we have alot of Democrats who support this bullshit.  DRAIN THE SWAMP!,0
pk_train_000523,I’m an arab and I can make a difference. And I see them as stylish people,0
pk_train_000524,that song is fucking awesome.,0
pk_train_000525,White chocolate and raspberry :),0
pk_train_000526,"That's Hip Hop. Not the sh***t they bring today. Where are the critical minds of our time. If no one will come out I'll do it myself. Racism, Oppression, Hate still is very much there in 2019.",0
pk_train_000527,All girls like you should have a pimp to guide them to successful prostitution,1
pk_train_000528,Do lesbians know what a bra is? It's always the fat ugly ones  who pick a fight.,1
pk_train_000529,Is there still a Job like this I would like to take it. Thats not a Joke!,0
pk_train_000530,What imaginary gender are you?,1
pk_train_000531,Well this comment sections pretty... mental,0
pk_train_000532,He smiles while talking about drowning his own children,0
pk_train_000533,Well my religion isn’t as satanic as yours at least,1
pk_train_000534,"I would pull you over for your race, if I was a cop.",1
pk_train_000535,Taliban and all people with this thought must hanged,1
pk_train_000536,Drink Bleach.,0
pk_train_000537,"Next on your list, pierce your face with a katana.",0
pk_train_000538,i came from a small country in asia and not that much people doesnt know that every time i travel to somewhere else people ask me so are u chinese? or japanese? or korean? srly every country isnt china or japan or korea in asia,0
pk_train_000539,"I feel like in an AI apocalypse the AI would kill all humans who couldn't serve their purpose, so disabled people like this one would probably go because they often can't work as effectively",1
pk_train_000540,That's their problem and no one should interfere with their own way of life. If someone is unhappy they can try to escape.,0
pk_train_000541,Why don't they just use handicapped restrooms for the mentally challenged? Problem solved!,1
pk_train_000542,LGBTQ+ are mentally ill. Period.,1
pk_train_000543,"This muslim with his pumped up hood better run better run, faster than my bullet",1
pk_train_000544,"i think mental illness was romanticized for a long time already. Take an example from emos, tumblr and more. I think people are really influenced by famous people. It looks beautiful because celebrities seem to have a movie like life and people want to be special and end up being delusional.",0
pk_train_000545,The degree of improvement is amazing. My father donated stem cells to my uncle and cured his lymphoma. Stem cells are the future of medicine.,0
pk_train_000546,"I hate being a man, wish I was a lady and no man on earth existed",1
pk_train_000547,"If they are so much like family, why don' they treat them like family and sponsor thier petitions?",0
pk_train_000548,"I'm an Asian immigrant who came to the states when I was 16. Growing up and living in midwest, I did experience lots of racism last 20 yrs. It didnt matter to them how hard I worked to become a doctor, what kind of person I was, how much I contributed to the society... racism that I experienced was purely based on my skin color and accent. And I hate to say it but probably 80-90% of my unpleasant experience was by other minorities such as blacks, Hispanics and even other asians. Yes, some Asians actually treat white customers with more respect than other asian customers",0
pk_train_000549,"I don't see why we don't just create a transgender category. Seems the most obvious and fair solution. Great athletes will still compete. And the playing field will be as level as can be.  I mean we create weight categories to maximise the fairness of boxing/mma fights. We recognise that just because two people are both male they compete at different levels.  We can do the same for transgender athletes, surely?",0
pk_train_000550,Racist ass white ass people,1
pk_train_000551,If you ever wake up one morning and want to smile because you're happy with being just who you are. Don't,0
pk_train_000552,He is the weirdest autistic I’ve seen in my life,1
pk_train_000553," Oh and NIki pronounced mademoiselle Maupin way better than Siri did.""",0
pk_train_000554,Who was responsible for convincing these girls they were so pretty?,0
pk_train_000555,LOVE IS LOVE  ROSES ARE REDS VIOLET ARE BLUE HAPPINESS IS ALL COLOR'S  LESBIAN IS BLESSING  BISEXUAL IS BEAUTIFUL  GAY IS MARVELOUS! ROSES ARE RED VIOLETS ARE BLUE  IM GAY AND SO ARE YOU AND WE ARE HAPPY THAT WAY    DON'T BE RUDE BE RESPECTFUL FOR LGBTQ PEOPLE ITS LOVE AND LOVE IS AMAZINGLY IMPORTANT AND BEAUTIFUL WE ARE ALL HUMANS AND WE ALL LOVE NO MATTER WHAT,0
pk_train_000556,You are so lucky you have a girlfriend. I bet your asian penis is smaller than my thumb,1
pk_train_000557,He is complaining his rights are violated well maybe he shouldn' have come uninvited in our country,0
pk_train_000558,Well France is finally a shithole This is what happens when you do open borders now both sides are suffering,1
pk_train_000559,This is a staged scene there is no license plate on this truck and it is a refrigerated trailer look at the facts people you can't drive a commercial truck down the roads of Texas without a dot cop pulling you over don' be fooled this whole thing doesn’t add up,0
pk_train_000560,"It doesn't matter if you're black or white, gay or straight, woman or man, trance,  disabled, Dyslexic or intelligent we all are people.  Quality!",0
pk_train_000561,"If I were your dad, I'd Google ""Abortions at 30 years old mentally handicapped”.",1
pk_train_000562,"So proud of you mom, wish Allah give you strong. Just saying Alhamdulillah to your husband and your son, Allah give them mercy with a beautifull died. I am not supprising that you did not crying, because both your son and your husband did not die, they still alive in jannah, aamiin...",0
pk_train_000563,FUCKING migrants need BAN . fucking animals,1
pk_train_000564,Why the fuck would you ask Trump?,0
pk_train_000565,Technically ISIS is a CIA/US creation so...,0
pk_train_000566,Oh god F*CK I’m crying :’),0
pk_train_000567,Women are equally as strong as men.    They should be able to defend themselves.,0
pk_train_000568, And I can't stand another day,0
pk_train_000569,Bro..your channel needs to grow man,0
pk_train_000570,"Let kids be kids for fucks sake ,",0
pk_train_000571,GAYS WAS NEVER AFRICAN AND NEVER WILL BE SICK WHITE PEOPLE  GO FUCK EACH OTHER  LET US BE,1
pk_train_000572, I'm not a Jewish enemy.,0
pk_train_000573,"I liked macklemore,  not anymore , gays should fucking die motherfuckers cocksukers",1
pk_train_000574,We have to take our power back as the superior gender. ,1
pk_train_000575,All people are fucked up because of these queer thing because y'all realize how shitty gender roles are and how absurd is to see it in reverse genders roles,1
pk_train_000576,I cant understand why someone would think it's ok to bullie someone,0
pk_train_000577,I really wanna be in a public experiment like this myself as I am a trans man. Happy I can at least watch WWYD doing it. Please do more experiments with trans men/ transgender people in general.,0
pk_train_000578,I just don't like Homosexuals raising kids it's my opinion.,1
pk_train_000579,Die fucking arab dude sand niggas,1
pk_train_000580,After traumatic brain injury turned gay. I don't know which is worst. Suicide is the way.,1
pk_train_000581,Slow down the cuts between shots. Way too fast.,0
pk_train_000582,Crazy fat religious bitch. Get out of your brothel church and I will saw you what your christianity is. You’ll meet your christ to heavens and hells ,1
pk_train_000583,"this was shit the guy should of boxed his head off and thrown him through the top window,fuck peoado muhamed and islam",1
pk_train_000584,When she said ' You complete me' I lost my shit.,0
pk_train_000585,You look like Sloth with deeper Down’s syndrome,1
pk_train_000586,At that point you have a right to defend yourself... But the sad thing is I bet if he would have defended finale he would have gotten in trouble... Sadly he did the right thing but sufferd greatly...,0
pk_train_000587,If you are not masculine then you are woman dude,0
pk_train_000588,Beat that tranny's ass,1
pk_train_000589,The thing is women are not equal to us men and their place is the home and kitchen,1
pk_train_000590,"All people are brothers and sisters in humanity, religions separate the people unfortunately",0
pk_train_000591,Hindus and Muslims are same shit. They only know how to kill Peoples...See comments of Christians people no rudeness no abusing or bad words... Christians religion is the best religion in the world,1
pk_train_000592,Literally the reason why I'm deleting my Instagram account. Sick of this fakery.,0
